{
  "accountId": "11111111-1111-4111-8111-111111111111",
  "contentHash": "9c658e0666f9d8acf4f5bb599b2b351e96737d2828cc56f3ada43eda61025453",
  "deviceId": "22222222-2222-4222-8222-222222222222",
  "deviceSequence": 1,
  "eventId": "33333333-3333-4333-8333-333333333333",
  "eventType": "purchase.registered",
  "occurrenceTime": "2026-07-14T12:00:00.000Z",
  "payload": {
    "productSnapshots": [
      {
        "accountId": "11111111-1111-4111-8111-111111111111",
        "displayBrand": "Fixture",
        "displayName": "Synthetic rice",
        "id": "66666666-6666-4666-8666-666666666666",
        "identityKey": "11111111-1111-4111-8111-111111111111|v3|synthetic rice|fixture|PACKAGED|MASS|1.000000|KG",
        "measurementKind": "MASS",
        "mode": "PACKAGED",
        "normalizationVersion": 3,
        "normalizedBrand": "fixture",
        "normalizedName": "synthetic rice",
        "packageQuantity": {
          "amount": "1.000000",
          "kind": "MASS",
          "scale": 6,
          "unit": "KG"
        },
        "userProductCode": {
          "displayValue": "RICE-001",
          "normalizedKey": "rice-001"
        }
      }
    ],
    "purchase": {
      "accountId": "11111111-1111-4111-8111-111111111111",
      "currencyCode": "BRL",
      "id": "44444444-4444-4444-8444-444444444444",
      "items": [
        {
          "id": "55555555-5555-4555-8555-555555555555",
          "lineTotal": { "currencyCode": "BRL", "minorUnits": 1299 },
          "packageCount": 1,
          "productId": "66666666-6666-4666-8666-666666666666",
          "purchaseId": "44444444-4444-4444-8444-444444444444",
          "purchasedQuantity": {
            "amount": "1.000000",
            "kind": "MASS",
            "scale": 6,
            "unit": "KG"
          }
        }
      ],
      "occurrenceTime": "2026-07-14T12:00:00.000Z",
      "paymentMethodId": null,
      "personId": null,
      "store": {
        "accountId": "11111111-1111-4111-8111-111111111111",
        "displayName": "test-store",
        "id": "77777777-7777-4777-8777-777777777777"
      },
      "totalMinorUnits": 1299
    }
  },
  "payloadVersion": 3
}
